Key,Desc,English,Russian,Spanish,Chinese (Simplified),Belarusian,French,German,Italian,Japanese,Korean,,Turkish,Ukrainian
ButtonStart,,Start,Старт,Arranque,,Старт,Lancement,Start,Start,スタート,시작,,Çalıştırmak,Старт
ButtonRestart,,Restart,Рестарт,Recomienzo,,Рэстарт,Reprise,Wiederanlauf,Restart,再起動,다시 시작,,Yeniden başlatma,Рестарт
ButtonMenu,,To Menu,В Меню,En El Menú,,У меню,Au Menu,Im Menü,Nel Menu,メニューの中で,메뉴에서,,Menüde,В Меню
ButtonContinue,,Continue,Продолжить,Continuar,,Продолжить,,,,,,,,
ButtonBack,,Back,Назад,Atrás,,Назад,En arrière,Zurück,Fa,戻る,뒤로,,Geri,Назад
ButtonMap,,To Map,На Карту,En El Mapa,,На Карту,Sur La Carte,Auf Der Karte,Sulla Mappa,地図へ,지도에,,Haritaya,На Карту
ButtonSetting,,Setting,Настройки,Ajustes,,Налады,Réglages,Die Einstellungen,Regolazioni,設定,설정,,Ayarlar,Настройка
ButtonExit,,Exit,Выход,Salida,,Выход,Sortie,Ausgang,Uscita,出口,출구,,Çıkış,Вихід
ButtonLoad,,Loading,Загрузить,Cargar,,Загрузіць,Télécharger,Hochladen,Caricare,ダウンロード,다운로드,,İndir,Завантаживши
ButtonLoad_2,,Loading,Загрузки,Cargas,,,,,,,,,,
ButtonDelete,,Delete,Удалить,Eliminar,,Выдаліць,Supprimer,Entfernen,Rimuovere,削除,제거,,Kaldırmak,Видалити
ButtonCancel,,Back,Назад,Atrás,,Назад,En arrière,Zurück,Fa,戻る,,,,Назад
ButtonNewSave,,New Save,Новое сохранение,Nuevo ahorro,,Новая захаванка,Nouvelle conservation,Neue Speicherung,Nuovo salvataggio,新しい保存,새 저장,,Yeni koruma,Нове збереження
ButtonSave,,Save,Сохранить,Guardar,,Захаваць,Enregistrer,Speichern,Mantenere,保存,저장,,Kaydetmek,Зберігши
InputText,,Enter a name,Введите имя,Introduzca un nombre,,Увядзіце імя,Entrez un nom,Geben Sie einen Namen ein,Inserisci un nome,名前を入力します,이름 입력,,Adı girin,Введіть ім'я
MusicTxt,,Music,Музыка,Músico,,Музыка,Musique,Die Musik,Musica,音楽,음악,,Müzik,Музика
SoundTxt,,Sound,Звуки,Sonidos,,Гукі,Son,Geräusche,Suoni,音,소리,,Sesler,Звук
LangTxt,,Language,Язык,Idioma,,Мова,Langue,Sprache,Lingua,言語,언어,,Dil,Мова
GoMenuTitle,,EXIT TO MENU,ВЫХОД В МЕНЮ,SALIR DEL MENÚ,,,,,,,,,,
GoMenuWorn,,The progress of the game will be lost!,Прогресс игры будет потерян!,Прогресс в игре будет потерян!,,,,,,,,,,
ButtonYes,,Yes,Да,Sí,,,,,,,,,,
ButtonNo,,No,Нет,No hay,,,,,,,,,,
AskExitGame,,"Do you want to 
to close the game?","Вы хотите 
закрыть игру?","¿Quieres 
¿cerrar el juego?",,,,,,,,,,
WinAddToWishlist_toAll,,"Be sure to add the game to the Wishlist on Steam, this is very important for us!!!","Обязательно добавьте игру в Вишлист на Стиме, для нас это очень важно!!!",¡Asegúrate de agregar el juego a la lista de Deseos en Steam para nosotros es muy importante!!!,,,,,,,,,,
DemoEnds,,"And about how the fate of the hero you can learn from the full version of the game, as well as you can try other story branches that are available in this demo","А о том как сложилась судьба героя вы можете узнать из полной версии игры, так же вы можете попробовать другие сюжетные ветки, которые доступны в этом демо","Y sobre cómo se desarrolló el destino del héroe se puede aprender de la versión completa del juego, así que usted puede probar otras ramas de la historia, que están disponibles en esta demo",,,,,,,,,,
DemoEnd_bunner,,,"На этом демо кончается, следите за новостями в нашей группе в ВК",,,,,,,,,,,
DemoEnd_cardLeft,,,"На этом демо кончается, следите за новостями в нашей группе в ВК",,,,,,,,,,,
DemoEnd_cardLeft_REV,,,"На этом демо кончается, следите за новостями в нашей группе в ВК",,,,,,,,,,,
DemoEnd_cardRight,,,"На этом демо кончается, следите за новостями в нашей группе в ВК",,,,,,,,,,,
DemoEnd_cardRight_REV,,,"На этом демо кончается, следите за новостями в нашей группе в ВК",,,,,,,,,,,
s1bunner,,You hear a knock at the door,Вы слышите стук в дверь,Oyes un golpe en la puerta,,,,,,,,,,
s1cardLeft,,Open the door,Открыть дверь,Abrir la puertas,,,,,,,,,,
s1cardRight,,Look out the window,Выглянуть в окно,Mirar por la ventana,,Вылазці ў акно.,Sortez par la fenêtre.,Raus aus dem Fenster.,Esci dalla finestra.,窓から出て行け,창 밖으로 나가,,Pencereden dışarı çık.,Вилізти у вікно.
s1revL,,You reluctantly get out of bed,Вы нехотя встаете с кровати,Te levantas de la cama a regañadientes,,Вы неахвотна ўстаеце з ложка.,Vous sortez du lit à contrecœur.,Sie stehen widerwillig aus dem Bett auf.,Ti alzi a malincuore dal letto.,あなたはしぶしぶベッドから出ます。,당신은 마지 못해 침대에서 얻을.,,İsteksizce yataktan kalkıyorsunuz.,Ви знехотя встаєте з ліжка.
s1revR,,You lean out of the window and ask what the uninvited guests want,"Вы высовываетесь из окна и спрашиваете, чего хотят незваные гости",Te asomas por la ventana y preguntas qué quieren los invitados no deseados,,"У гэтым дэма-версіі не даступна галіна з акном, але мы ўжо працуем над ёй.","Aucune branche avec fenêtre n'est disponible dans cette démo,
Mais nous y travaillons déjà.","Ein Zweig mit einem Fenster ist in dieser Demo nicht verfügbar,
Aber wir arbeiten bereits daran.","Nessun ramo con finestra è disponibile in questa demo,
Ma ci stiamo già lavorando.","このデモでは、ウィンドウのあるブランチは使用できません,
しかし、私たちはすでにそれに取り組んでいます。","이 데모에서는 창이 있는 지점을 사용할 수 없습니다,
그러나 우리는 이미 그것에 노력하고 있습니다.",,"Bu demoda pencereli bir şube mevcut değil,
Ama biz zaten üzerinde çalışıyoruz.","У цьому демо не доступна гілка з вікном,
Але ми вже працюємо над нею."
s1revLno,,Set 1 Reverse Left No Item,Пара 1 Реверс Левый Нет предмета,,,,,,,,,,,
s1revRno,,Set 1 Reverse Right No Item,Пара 1 Реверс Правый Нет предмета,,,,,,,,,,,
2_Guard_bunner,,"There were royal guards outside the door.
They want you to go to the palace","За дверью оказалась царская стража
Требуют, чтобы вы отправились во дворец","Tras la puerta se encontraba la guardia real.
Te piden que vayas al Palacio",,"За дзвярыма апынулася каронная варта. Яны патрабуюць, каб вы адправіліся ў палац.","Derrière la porte se trouvait la garde royale
Exiger que vous alliez au palais","Die königliche Wache stand vor der Tür
Sie verlangen, dass Sie in den Palast gehen","Dietro la porta c'era una guardia reale
Ti chiedono di andare al Palazzo","ドアの外には王室の警備員がいました
彼らはあなたが宮殿に行くことを要求します","문 밖에 왕실 경비원이 있었다
그들은 당신이 궁전에 갈 것을 요구",,"Kapının dışında kraliyet muhafızı vardı
Saraya gitmenizi istiyorlar","За дверима опинилася королівська варта
Вимагають щоб ви вирушили до палацу"
2_Guard_cardLeft,,Agree to go,Согласиться пойти,Aceptar ir,,Сгодзіцца пайсці.,Accepter d'aller,Zustimmen zu gehen,Accetta di andare,行くことに同意する,가기로 동의,,Gitmeyi kabul etmek,Погодитися піти
2_Guard_cardLeft_REV,,You agree to go to the castle,Вы соглашаетесь отправиться во дворец,Usted acepta ir al Palacio,,Вы згаджаецеся адправіцца ў палац.,Vous acceptez d'aller au palais,"Sie stimmen zu, in den Palast zu gehen",Accetti di andare al Palazzo,あなたは宮殿に行くことに同意します,당신은 궁전에 갈 것에 동의합니다,,Saraya gitmeyi kabul ediyorsunuz,Ви погоджуєтеся відправитися до палацу
2_Guard_cardRight,,Slam the door in their face,Хлопнуть дверью у них перед носом,Cerrar la puerta delante de sus narices,,Хлопнуць дзвярыма ў іх перад носам.,,,,,,,,
2_Guard_cardRight_REV,,"Making a face, you slam the door in front of the guards, the guards didn't like it","Скорчив физиономию, вы хлопаете дверью перед носом у стражников, им это не понравилось","Con la cara entrecortada, golpeas la puerta delante de la nariz de los guardias, no les gustó",,"Скривіўшы твар, вы хлопаеце дзвярыма перад носам у вартаўнікоў, і гэта ім не спадабалася.",,,,,,,,
2_KingGuardOnDoor_bunner,,"The royal guards are at your door, demanding that you go with them to the king's castle","У вашей двери стоит королевская стража, и они требуют, чтобы вы отправились с ними в замок к царю",La guardia real está en tu puerta y exige que vayas con ellos al castillo del rey,,Як вы будзеце дабірацца да замка?,,,,,,,,
2_KingGuardOnDoor_cardLeft,,Agree,Согласиться,Aceptar ir,,Адправіцца самому.,,,,,,,,
2_KingGuardOnDoor_cardLeft_REV,,You agree to go to the castle,Вы соглашаетесь отправиться в замок,Aceptas ir al castillo,,Вы дабярэцеся да палаца самастойна.,,,,,,,,
2_KingGuardOnDoor_cardRight,,Be rude,Нагрубить,Ser grosero,,На возе з ахоўнікамі.,,,,,,,,
2_KingGuardOnDoor_cardRight_REV,,"You shout: ""Who are you? I didn't call for you! Go to hell!","Вы кричите: ""Кто вы такие я вас не звал идите к черту""","Gritas: ""¿Quiénes son ustedes? ¡No los llamé! ¡Váyanse al diablo!""",,Вы залазіце ў воз і едзеце ў палац.,,,,,,,,
3_GuardSlamDoor_bunner,,The guards knocked down the door and now you are going to the palace under supervision,"Стража выбила дверь и теперь
 вы едете во дворец под присмотром","Los guardias golpearon la puerta y ahora
 usted va al Palacio bajo supervisión",,"Вартаўнікі выбілі дзверы, і цяпер вы едзеце ў замак пад аховай.",,,,,,,,
3_GuardSlamDoor_cardLeft,,,Сесть в повозку,,,Сесці бліжэй да краю вазкі.,,,,,,,,
3_GuardSlamDoor_cardLeft_REV,,You decide to stop resisting,Вы решаете прекратить сопротивление,Decides dejar de resistirte,,"Вы садзіцеся бліжэй да краю вазкі, каб не раздражаць вартаўнікоў.",,,,,,,,
3_GuardSlamDoor_cardRight,,Continue to resist,Продолжить сопротивляться,Seguir resistiendo,,Працягваць супраціўляцца.,,,,,,,,
3_GuardSlamDoor_cardRight_REV,,"You push the guards and behave defiantly, for which you get a strong blow","Вы толкаете стражников и ведете себя вызывающе, за что получаете сильный удар","Usted empuja a los guardias y se comporta desafiante, por lo que recibe un fuerte golpe",,"Вы штурхаеце вартаўнікоў і паводзіце сябе выклікаюча, за што атрымліваеце моцны ўдар.",,,,,,,,
3_StealAppleQ_bunner,,,"Вы идёте по базару, поглядывая на стражу, и вдруг замечаете прилавок с особенно спелыми фруктами и овощами - рука так и тянется стащить",,,,,,,,,,,
3_StealAppleQ_cardLeft,,,Стащить из-под носа у продавца ,,,,,,,,,,,
3_StealAppleQ_cardLeft_REV,,,Вас замечает продавец и бьет палкой по голове,,,,,,,,,,,
3_StealAppleQ_cardRight,,,Стащить с ближнего к вам прилавка,,,,,,,,,,,
3_StealAppleQ_cardRight_REV,,,"Продавец замечает, но вы успеваете увернуться от его палки",,,,,,,,,,,
,,,,,,,,,,,,,,
,,,,,,,,,,,,,,
,,,,,,,,,,,,,,
,,,,,,,,,,,,,,
,,,,,,,,,,,,,,
4_PovozkaPlaceToSeat_bunner,,"The carriage is quite free, where will you sit?","В повозке довольно свободно, куда сядете?","En el transporte es bastante libre, ¿dónde se sentará?",,"У возе даволі вольна, куды сядзеце?",,,,,,,,
4_PovozkaPlaceToSeat_cardLeft,,Sit at the edge of the cart,Сесть к краю повозки,Sentarse al borde del carro,,Сесці да краю павозкі.,,,,,,,,
4_PovozkaPlaceToSeat_cardLeft_REV,,You sit closer to the edge of the cart so as not to annoy the guards,"Вы садитесь ближе к краю повозки, чтобы не раздражать стражу",Te sientas más cerca del borde del carro para no provocar a la guardia,,"Вы садзіцеся бліжэй да краю павозкі, каб не раздражаць вартаў.",,,,,,,,
4_PovozkaPlaceToSeat_cardRight,,Get in deeper,Залезть поглубже,Siéntese en el centro,,Вы залезеце паглыбей у павозку.,,,,,,,,
4_PovozkaPlaceToSeat_cardRight_REV,,"You climb into the center of the cart, and find a bent nail under your backside","Вы залезаете в центр повозки, и обнаруживаете под своим задом гнутый гвоздь",Te metes en el centro del carro y encuentras un clavo doblado debajo de tu trasero,,Вы залезеце ў цэнтр павозкі і выяўляеце пад сваім задом гнуты цвік.,,,,,,,,
4_RoadToTraktir_bunner,,,"По воле судьбы на вашем пути встречается трактир, и у вас не остаётся выбора, кроме как войти внутрь",,,,,,,,,,,
4_RoadToTraktir_cardLeft,,,Узнать у трактирщика последние новости и выпить эля,,,,,,,,,,,
4_RoadToTraktir_cardLeft_REV,,,"Он рад вас видеть, предлагает присесть и показывает листовку",,,,,,,,,,,
4_RoadToTraktir_cardRight,,,Взять эля и присесть за столик к мужикам,,,,,,,,,,,
4_RoadToTraktir_cardRight_REV,,,"Вы садитесь за стол, кого-то вы знаете, кого - то видите впервые",,,,,,,,,,,
4_Traktir_bunner,,,"На листовке изображение девушки и надпись - пропала принцесса, а также обещание вознаграждения ",,,,,,,,,,,
4_Traktir_cardLeft,,,Как она пропала?,,,,,,,,,,,
4_Traktir_cardLeft_REV,,,Трактирщик сказал что по слухам ее похитил дракон,,,,,,,,,,,
4_Traktir_cardRight,,,Кто-то уже пытался ее отыскать? ,,,,,,,,,,,
4_Traktir_cardRight_REV,,,"Трое смельчаков ушли и не вернулись. Значит, либо погибли, либо почти у цели…",,,,,,,,,,,
4_2_Traktir_bunner,,"The innkeeper tells you that a dragon has recently kidnapped a princess, and the king, desperate and having heard of your exploits, is looking for you","Трактирщик рассказывает вам что недавно дракон похитил принцессу, а царь, отчаявшись и прослышав о ваших подвигах, ищет именно вас","El posadero te cuenta que un dragón ha secuestrado recientemente a una princesa, y el rey, desesperado y habiendo oído hablar de tus hazañas, te busca",,,,,,,,,,
4_Capable_bunner,,,"Говорят, царь по всему краю ищет кого-то толкового. Обещана награда, и возможно еще кое - что...",,,,,,,,,,,
4_Capable_cardLeft,,,Пожать плечами ,,,,,,,,,,,
4_Capable_cardLeft_REV,,,Неужели награда такая большая что за нее стоит рискнуть жизнью?,,,,,,,,,,,
4_Capable_cardRight,,,Толковый - это ещё кто?,,,,,,,,,,,
4_Capable_cardRight_REV,,,"Трактирщик смеясь -  Все ""толковые"" - уже в пасти у дракона",,,,,,,,,,,
4_Reward_bunner,,,"Трактирщик кивает - Говорят, сундук золота, почет, да и принцесса - если вы с ней сладите",,,,,,,,,,,
4_Reward_cardLeft,,,"А что, принцесса - то красивая?",,,,,,,,,,,
4_Reward_cardLeft_REV,,,"Конечно, но с характером. Одного чуть не казнила за плохую песню",,,,,,,,,,,
4_Reward_cardRight,,,"А может знаешь, что полезное про этого дракона?",,,,,,,,,,,
4_Reward_cardRight_REV,,,"Трактирщик протягивает вам страницу из книги - вот почитай если решишься идти, тут про того дракона написано",,,,,,,,,,,
4_TraktirTales_bunner,,,Мужики травят байки вы слушаете и подключаетесь к беседе,,,,,,,,,,,
4_TraktirTales_cardLeft,,,Продолжить травить байки взяв еще одну кружечку эля,,,,,,,,,,,
4_TraktirTales_cardLeft_REV,,,"Беседа идет веселее, когда в кружке что-то плещется",,,,,,,,,,,
4_TraktirTales_cardRight,,,Внимательно слушать что говорят,,,,,,,,,,,
4_TraktirTales_cardRight_REV,,,"Говорят, что чемпион по кулачным боям, несмотря на свою медлительность, очень внимателен",,,,,,,,,,,
4_Taunt_bunner,,,"Один из них встаёт, и предлагает ответить за свои слова",,,,,,,,,,,
4_Taunt_cardLeft,,,Встать и принять вызов,,,,,,,,,,,
4_Taunt_cardLeft_REV,,,"Противник оказался довольно быстр, и вы пропускаете удар в живот и больше вам не хочется продолжать",,,,,,,,,,,
4_Taunt_cardRight,,,"Сказать, что уделаете его не вставая со стула",,,,,,,,,,,
4_Taunt_cardRight_REV,,,"Вы метко швыряете железную кружку в голову дебоширу, он падает, мужики смеются",,,,,,,,,,,
4_Taunt_2_bunner,,,"Вы смотрите на остальных ""смельчаков"" и у вас возникает сильное желание их поддеть",,,,,,,,,,,
4_Taunt_2_cardLeft,,,Не сдерживать себя,,,,,,,,,,,
4_Taunt_2_cardLeft_REV,,,"Вы отпускаете колкость в сторону ""смельчаков"" за столом",,,,,,,,,,,
4_Taunt_2_cardRight,,,Не говорить ничего,,,,,,,,,,,
4_Taunt_2_cardRight_REV,,,Сегодняшний день и так был полон беспокойства,,,,,,,,,,,
4_Taunt_3_bunner,,,"Вы не успеваете ответить - с соседнего стола раздаётся хохот. Один из мужиков поднимает кружку - Так значит, ты теперь самый толковый?",,,,,,,,,,,
4_Taunt_3_cardLeft,,,Подколоть их ,,,,,,,,,,,
4_Taunt_3_cardLeft_REV,,,"Если вы - лучшие, то не удивительно, что дракон до сих пор жив",,,,,,,,,,,
4_Taunt_3_cardRight,,,Не обращать внимания,,,,,,,,,,,
4_Taunt_3_cardRight_REV,,,Сегодняшний день и так был полон беспокойства,,,,,,,,,,,
4_InnKeeperStillTalk_bunner,,,Вы продолжаете разговор с трактирщиком,,,,,,,,,,,
4_InnKeeperStillTalk_cardLeft,,,Кто мог ее украсть?,,,,,,,,,,,
4_InnKeeperStillTalk_cardLeft_REV,,,"Трактирщик сказал, что по слухам ее похитил зеленый дракон",,,,,,,,,,,
4_InnKeeperStillTalk_cardRight,,,Как давно это случилось?,,,,,,,,,,,
4_InnKeeperStillTalk_cardRight_REV,,,"Трактирщик смеется и говорит - Вроде как дракон забрал ее с три недели назад, все то время пока ты сладко спал на печи",,,,,,,,,,,
4_Doubts_bunner,,,"Дело, кажется, довольно опасным, дракон, да еще и путь лежит не близкий, попытаете счастье в бою с драконом?",,,,,,,,,,,
4_Doubts_cardLeft,,,А почему бы и нет!,,,,,,,,,,,
4_Doubts_cardLeft_REV,,,"Вы встаете и громко заявлете всем что вы освободите принцессу, ну и конечно же заберете вознаграждние",,,,,,,,,,,
4_Doubts_cardRight,,,Вам что-то не хочется в этом участвовать,,,,,,,,,,,
4_Doubts_cardRight_REV,,,"Вы не были сильно близки с царским родом, да и поджариться в пасти дракона не лучшая перспектива",,,,,,,,,,,
4_MensAgree_bunner,,,"Все понимающе кивают, а один из посетителей, подходит к вам и что-то похожее на кость",,,,,,,,,,,
4_MensAgree_cardLeft,,,Внимательно осмотреть,,,,,,,,,,,
4_MensAgree_cardLeft_REV,,,"Незнакомец, советует взять ее с собой если вы решить пойти через топи, в качестве оберега от Бабы - Яги",,,,,,,,,,,
4_MensAgree_cardRight,,,Не принимать даров от незнакомцев,,,,,,,,,,,
4_MensAgree_cardRight_REV,,,"Отказаться от подарка, сказав, что у вас таких и у самого полно",,,,,,,,,,,
,,,,,,,,,,,,,,
4_2_TraktirTales_bunner,,,"Вы продолжаете общение, кто-то пошутил про короля, и все замолкли, вы не поняли причину",,,,,,,,,,,
4_2_TraktirTales_cardLeft,,,Сходить за еще одной кружечкой эля,,,,,,,,,,,
4_2_TraktirTales_cardLeft_REV,,,Эль оказался забористый и в глазах немного мутнеет,,,,,,,,,,,
4_2_TraktirTales_cardRight,,,Пойти подкрепиться,,,,,,,,,,,
4_2_TraktirTales_cardRight_REV,,,"Вы съедаете похлебку, которая кажется вам волшебной",,,,,,,,,,,
4_SneakOnGuards_bunner,,You hear the guard tell you that there is grief and the king orders a hero from the outskirts to come to the castle,"Вы слышите, как стражник рассказывает, что случилось несчастье и король приказывает герою с окраины, то есть нам явиться в замок",Escuchas al guardia decirte que hay dolor y el rey ordena a un héroe de las afueras que venga al castillo,,,,,,,,,,
4_SneakOnGuards_cardLeft,,,"Дождаться пока стража уйдет и подслушать, о чем начнут шептаться торговцы",,,,,,,,,,,
4_SneakOnGuards_cardLeft_REV,,,"Вы узнали, что конюх изменяет своей жене с дочкой мясника, ценность информации под вопросом",,,,,,,,,,,
4_SneakOnGuards_cardRight,,,Дождаться пока стража отойдет от палатки и спросить у торговца подробности,,,,,,,,,,,
4_SneakOnGuards_cardRight_REV,,,"Ничего нового и внятного торговец вам сказать так и не смог, он был сильно напуган тем, что на рынок заявилась стража",,,,,,,,,,,
4_SpyOnGuards_bunner,,,"Вы идете по рынку и замечаете, что стражник показывают листовки торговцу, один из них с вашим портретом ",,,,,,,,,,,
4_SpyOnGuards_cardLeft,,Continue secret surveillance of the guards,Продолжить тайную слежку за стражниками,Continuar la vigilancia secreta de los guardias reales,,,,,,,,,,
