Key,Desc,English,Russian,Spanish,Chinese (Simplified),Belarusian,French,German,Italian,Japanese,Korean,,Turkish,Ukrainian
6_in_Castle_cardRight,,Start feeling the walls in the semi-darkness,Начать ощупывать стены в полумраке,Explorar a tientas las paredes del oscuro pasaje,,,,,,,,,,
6_in_Castle_cardRight_REV,,"You touch the stone's letters - they form: ""The wall reveals its secret to those who hear the stone""","Вы нащупываете буквы на одном из камней, они складываются в надпись: ""Стена откроет тайну тому, кто слышит камень""","Palpas las letras en una de las piedras, que forman una inscripción: ""La pared revelará su secreto a quien escuche la voz de la piedra",,,,,,,,,,
6_KingsPlace_bunner,,"You were introduced to the inconsolable king, who bitterly recounted the story that a dragon had kidnapped the princess","Вас представили безутешному царю,
который с горечью поведал о том,
что дракон похитил принцессу","Te presentan ante el desconsolado zar,
quien, con amargura, relata cómo el dragón secuestró a la princesa
",,"Вас прывезлі да безутешнага караля, які з гораю распавёў пра тое, як дракон схапіў яго прынцэсу.",,,,,,,,
6_KingsPlace_cardLeft,,Ask how it concerns you?,Спросить причем здесь вы?,"Preguntar: ""¿Y qué tengo que ver yo con esto?""",,"Запытацца, якое да вас дачыненне?",,,,,,,,
6_KingsPlace_cardLeft_REV,,"But after looking at the stern guards, you decided to keep quiet and continue listening","Но, глянув на суровую стражу, вы решили помолчать и продолжить слушать","Pero, al mirar a la severa guardia, decidiste guardar silencio y seguir escuchando",,"Ахова кідае на вас незадавальняючыя погляды, але кароль, уздыхнуўшы, працягвае свой аповяд.",,,,,,,,
6_KingsPlace_cardRight,,Continue listening,Продолжить слушать,Seguir escuchando,,Працягнуць слухаць,,,,,,,,
6_KingsPlace_cardRight_REV,,You continue to listen to the king's story without enthusiasm,Вы без энтузиазма продолжаете слушать историю короля,"Sin entusiasmo, sigues escuchando la historia del zar",,Вы без энтузіязму працягваеце слухаць гісторыю караля,,,,,,,,
6_KingsPlace2_bunner,,"You came to the castle to the inconsolable king, who bitterly told about that, How the dragon kidnapped his princess","Вы пришли в замок к безутешному царю,
который с горечью поведал о том,
что дракон похитил его принцессу","Has llegado al castillo del desconsolado zar,
quien, con amargura, te contó que el dragón secuestró a su princesa",,"Вы прыйшлі ў замак да няўцешнаму каралю,
які з горыччу распавёў пра тое,
як цмок выкраў яго прынцэсу",,,,,,,,
6_KingsPlace2_cardLeft,,Ask how it concerns you?,Спросить причем здесь вы?,"Preguntar: ""¿Y qué tengo que ver yo con esto?""",,"Запытацца, якое да вас дачыненне?",,,,,,,,
6_KingsPlace2_cardLeft_REV,,"The guards look at you with displeasure, but the king sighs and continues his story","Стража бросает на вас недовольные взгляды, но царь, вздохнув, продолжает свой рассказ","La guardia te lanza miradas de desaprobación, pero el zar, suspirando, continúa su relato",,"Варта кідае на вас незадаволеныя погляды, але кароль, уздыхнуўшы, працягвае свой аповяд",,,,,,,,
6_KingsPlace2_cardRight,,Continue listening,Продолжить слушать,Seguir escuchando,,Працягнуць слухаць,,,,,,,,
6_KingsPlace2_cardRight_REV,,You continue to listen to the king's story without enthusiasm,Вы без энтузиазма продолжаете слушать эту печальную историю,"Sin entusiasmo, sigues escuchando la historia del zar",,Вы без энтузіязму працягваеце слухаць гісторыю караля,,,,,,,,
6_1_BoatCrush_bunner,,"You sail a decent distance away and then a hurricane hits, hurling the ship violently against the shore. It's a miracle you're alive","Вы отплываете на порядочное расстояние и тут же начинается ураган, корабль с силой швыряет о берег. Вы чудом остались живы","Zarpas a una distancia considerable, pero de repente comienza un huracán. El barco es arrojado con fuerza contra la orilla. Sobrevives de milagro",,,,,,,,,,
6_1_BoatCrush_cardLeft,,Play dead,Прикинуться мертвым,Fingir estar muerto,,,,,,,,,,
6_1_BoatCrush_cardLeft_REV,,"The guards have bought into your trick, and you decide to relieve stress in the tavern","Стражники купились на ваш трюк, а вы решаете снять стресс в трактире","Los guardias cayeron en tu engaño, y tú decides aliviar el estrés en la taberna",,,,,,,,,,
6_1_BoatCrush_cardRight,,Hide in a thicket near the shore,Спрятаться в зарослях рядом с берегом,Esconderse entre la maleza junto a la orilla,,,,,,,,,,
6_1_BoatCrush_cardRight_REV,,You sneak through the bushes and hide among the trees. The guards don't find you and you run home through the forest,"Вы ползком пробираетесь в кусты и прячетесь среди деревьев. Стража вас не находит, и вы сбегаете домой через лес","Te arrastras hasta los arbustos y te ocultas entre los árboles. La guardia no te encuentra, y logras escapar a casa atravesando el bosque",,,,,,,,,,
6_1_BoatCheck_bunner,,You sail a short distance away and the captain arranges a crew inspection,"Вы отплываете на небольшое расстояние, и капитан устраивает проверку экипажа",Zarpas a corta distancia y el capitán inicia una inspección de la tripulación,,,,,,,,,,
6_1_BoatCheck_cardLeft,,Take advantage of the commotion and launch a dinghy,Воспользоваться суетой и спустить на воду шлюпку,Aprovechar el alboroto y botar un bote al agua,,,,,,,,,,
6_1_BoatCheck_cardLeft_REV,,"You leave the ship and carefully swim towards the shore, after this you should freshen up at the tavern","Вы покидаете корабль и осторожно плывете в сторону берега, после такого надо освежиться в трактире ","Abandonas el barco y remas con cuidado hacia la orilla. Después de semejante aventura, necesitas refrescarte en la taberna",,,,,,,,,,
6_1_BoatCheck_cardRight,,Merge with the crew,Слиться с экипажем,Mezclarse con la tripulación,,,,,,,,,,
6_1_BoatCheck_cardRight_REV,,"The attempt fails, the captain spots you. and sends you ashore in a dinghy into the hands of the guards","Попытка проваливается, капитан замечает вас. И отправляют на шлюпке на берег в руки стражи","El intento fracasa, el capitán te nota. Te envían en un bote a la orilla, directo a manos de la guardia",,,,,,,,,,
6_1_GreenCheese_bunner,,,"Вы изрядно проголодались. Обыскивая каюты, находите кусок сыра - его плесень светится благородным зелёным оттенком",,,,,,,,,,,
6_1_GreenCheese_cardLeft,,,,,,,,,,,,,,
6_1_GreenCheese_cardLeft_REV,,,,,,,,,,,,,,
6_1_GreenCheese_cardRight,,,,,,,,,,,,,,
6_1_GreenCheese_cardRight_REV,,,,,,,,,,,,,,
7_RiverWashFace_bunner,,,"Вы идёте к реке, чтобы смыть грязь, один из стражников идет с вами. Вода в реке холодная, течение быстрое",,,,,,,,,,,
7_RiverWashFace_cardLeft,,,Отвлечь стражника и попытаться сбежать,,,,,,,,,,,
7_RiverWashFace_cardLeft_REV,,,"Неожиданно толкаешь его в реку. Он с грохотом падает в воду, ругаясь. У вас есть время, чтобы скрыться",,,,,,,,,,,
7_RiverWashFace_cardRight,,,Нырнуть в воду,,,,,,,,,,,
7_RiverWashFace_cardRight_REV,,,"Вы скрываетесь под водой, и незаметно вплываете под листвой, стражник подумал что вы утонули и ушел",,,,,,,,,,,
7_GoWhere_bunner,,,Выплыв и отряхнувшись вы думаете куда пойти,,,,,,,,,,,
7_GoWhere_cardLeft,,,Промочить горло,,,,,,,,,,,
7_GoWhere_cardLeft_REV,,,Вам очень захотелось выпить эля,,,,,,,,,,,
7_GoWhere_cardRight,,,Проследить за стражей,,,,,,,,,,,
7_GoWhere_cardRight_REV,,,Вам стало интересно что все - таки нужно стражникам от вас,,,,,,,,,,,
7_Guard_in_Water_bunner,,,"Стражник барахтается в воде, он начинает тонуть, похоже что он не умеет плавать",,,,,,,,,,,
7_Guard_in_Water_cardLeft,,,Помочь тонущему,,,,,,,,,,,
7_Guard_in_Water_cardLeft_REV,,,"Вы сталкиваете бревно с берега и стражник, хватаясь за него пытается выплыть на берег",,,,,,,,,,,
7_Guard_in_Water_cardRight,,,Не помогать,,,,,,,,,,,
7_Guard_in_Water_cardRight_REV,,,Вас в данный момент вас интересует только личная судьба,,,,,,,,,,,
7_WagonBroke_bunner,,,"Наехав на камень колесо ломается и вся телега разваливается, вы улетаете в кусты и прячетесь там, пока стража не найдя вас уходит  ",,,,,,,,,,,
7_WagonBroke_cardLeft,,,Попытаться следить за стражей с ближайшей крыши,,,,,,,,,,,
7_WagonBroke_cardLeft_REV,,,"Опора под ногой крошится,  вы срываетесь вниз и больно бьетесь плечом. Лучше продолжить слежку пешком",,,,,,,,,,,
7_WagonBroke_cardRight,,,Проследить за стражей,,,,,,,,,,,
7_WagonBroke_cardRight_REV,,,Стража уходит  в сторону базара,,,,,,,,,,,
7_DeadEnd_bunner,,"You scratch your head, wondering what it means, and do what you think is right","Вы чешете голову, недоумевая что это значит, и делаете то, что вам кажется правильным","Te rascas la cabeza, sin comprender su significado, y haces lo que te parece correcto",,,,,,,,,,
7_DeadEnd_cardLeft,,Listen to the stones,Послушать камни,Escuchar a las piedras,,,,,,,,,,
7_DeadEnd_cardLeft_REV,,"You tap on the rocks and listen to the sound, one sounds different from the others","Вы легонько стучите по камням и прислушиваетесь к звуку, один звучит иначе, чем остальные",Golpeas las piedras y escuchas atentamente. Una de ellas suena diferente a las demás,,,,,,,,,,
7_DeadEnd_cardRight,,,"Начать громко кричать на камни, в ожидании эха",,,,,,,,,,,
7_DeadEnd_cardRight_REV,,,"Ваши крики услышали стражники, но вам удалось от них сбежать",,,,,,,,,,,
7_1_DeadEnd_bunner,,"You press the stone, and activate a hidden mechanism. The wall slides open, revealing a passage into a dark corridor","Вы жмете на камень, и активируете скрытый механизм. Стена раздвигается, открывая проход в тёмный коридор","Presionas la piedra y activas un mecanismo oculto. La pared se aparta, revelando un pasaje hacia un oscuro corredor",,,,,,,,,,
7_1_DeadEnd_cardLeft,,Continue to inspect the walls,Продолжить осматривать стены,Seguir examinando las paredes,,,,,,,,,,
7_1_DeadEnd_cardLeft_REV_NO,,,"Вы замечаете слабое свечение, это замочная скважина. Вот бы что-то чем ее открыть, хотя бы старый гвоздь ",,,,,,,,,,,
7_1_DeadEnd_cardLeft_REV_YES,,,"Вы замечаете слабое свечение, это замочная скважина. Используя гвоздь, вместо ключа, вы открываете замок",,,,,,,,,,,
7_1_DeadEnd_cardRight,,Walk forward without looking at the walls,"Быстро пройти вперед, не осматривая стены",Avanzar rápidamente sin examinar las paredes,,,,,,,,,,
7_1_DeadEnd_cardRight_REV,,Walk forward without looking at the walls,"Быстро пройти вперед, не осматривая стены",Avanzar rápidamente sin examinar las paredes,,,,,,,,,,
7_1_StrongFigter_bunner,,,"Вы возвращаетесь за стол, а там уже вовсю обсуждают, что пора бы устроить еженедельные кулачные бои. Более того - вас уже записали в команду",,,,,,,,,,,
7_1_StrongFigter_cardLeft,,,Умыться и постараться протрезветь,,,,,,,,,,,
7_1_StrongFigter_cardLeft_REV_YES,,,"Против вас будет драться крупный мужик. Боясь, что яблоко не переживёт сражения, вы отдаёте его пацану на хранение",,,,,,,,,,,
7_1_StrongFigter_cardLeft_REV_NO,,,"Против вас выставили чемпиона прошлой недели, крупного и с виду очень сильного мужика",,,,,,,,,,,
7_1_StrongFigter_cardRight,,,Взбудоражить кровь перед схваткой,,,,,,,,,,,
7_1_StrongFigter_cardRight_REV,,,"Против вас - чемпион прошлой недели, крупный мужик. Вы даёте себе пару пощёчин, чтобы взбодриться перед боем",,,,,,,,,,,
7_2a_StrongFigter_bunner,,,"Вы выходите на улицу, толпа собирается в круг, крики и ставки раздаются со всех сторон, а в глазах по-прежнему мутно",,,,,,,,,,,
7_2a_StrongFigter_cardLeft,,,Занять боевую стойку и ждать первого удара,,,,,,,,,,,
7_2a_StrongFigter_cardLeft_REV,,,"Вы ждете первого удара, и вы его получаете, блок вас не спасает, удар слишком сильный",,,,,,,,,,,
7_2a_StrongFigter_cardRight,,,Сразу атаковать первым,,,,,,,,,,,
7_2a_StrongFigter_cardRight_REV,,,"Вы бьёте первым, но вы слишком много выпили. Противник встречает удар плечом и с хрустом отвечает кулаком в грудь",,,,,,,,,,,
7_2b_StrongFigter_bunner,,,"Вы выходите на улицу, толпа собирается в круг, крики и ставки раздаются со всех сторон, а в глазах по-прежнему мутно",,,,,,,,,,,
7_2b_StrongFigter_cardLeft,,,Занять боевую стойку и ждать первого удара,,,,,,,,,,,
7_2b_StrongFigter_cardLeft_REV,,,"Вы ждете первого удара, и вы его получаете, блок вас не спасает, удар слишком сильный",,,,,,,,,,,
7_2b_StrongFigter_cardRight,,,Сразу атаковать первым,,,,,,,,,,,
7_2b_StrongFigter_cardRight_REV,,,"Вы бьёте первым, но вы слишком много выпили. Противник встречает удар плечом и с хрустом отвечает кулаком в грудь",,,,,,,,,,,
7_3_StrongFigter_bunner,,,"Противник идёт в наступление. Он широко замахивается, и кулак несётся прямо к вам",,,,,,,,,,,
7_3_StrongFigter_cardLeft,,,Увернуться в сторону,,,,,,,,,,,
7_3_StrongFigter_cardLeft_REV_YES,,,"Вы уклоняетесь, и кулак пролетает мимо, но поскальзываетесь и падаете на землю раздавив яблоко",,,,,,,,,,,
7_3_StrongFigter_cardLeft_REV_NO,,,"Вы уклоняетесь, и кулак пролетает мимо, но поскальзываетесь и бьетесь головой об землю",,,,,,,,,,,
7_3_StrongFigter_cardRight,,,Ответить ударом в челюсть,,,,,,,,,,,
7_3_StrongFigter_cardRight_REV,,,"Ваш кулак попадает в цель, но и его - тоже. Удар был сильным, вы чудом устояли на ногах",,,,,,,,,,,
7_4a_StrongFigter_bunner,,,"Противник уже начал уставать, но все ещё опасен. Толпа ждёт зрелища",,,,,,,,,,,
7_4a_StrongFigter_cardLeft,,,Отступить на шаг чтобы отдышаться,,,,,,,,,,,
7_4a_StrongFigter_cardLeft_REV_YES,,,"Вдруг пацан из толпы бросает вам яблоко, и вы быстро съедаете его и получаете заряд сил ",,,,,,,,,,,
7_4a_StrongFigter_cardRight,,,Попробовать обманный финт,,,,,,,,,,,
7_4a_StrongFigter_cardRight_REV,,,"Вы почти обманули его, но в последний момент он видит уловку и бьёт в ответ",,,,,,,,,,,
7_4c_StrongFigter_bunner,,,"Противник уже начал уставать, но все ещё опасен. Толпа ждёт зрелища",,,,,,,,,,,
7_4c_StrongFigter_cardLeft,,,Отступить на шаг чтобы отдышаться,,,,,,,,,,,
7_4c_StrongFigter_cardLeft_REV,,,Вы немного отдышались и готовы обдумать новую тактику,,,,,,,,,,,
7_4c_StrongFigter_cardRight,,,Попробовать обманный финт,,,,,,,,,,,
7_4c_StrongFigter_cardRight_REV,,,"Вы почти обманули его, но в последний момент он видит уловку и бьёт в ответ",,,,,,,,,,,
7_4d_StrongFigter_bunner,,,"Противник мотает головой, немного пошатывается, но ещё опасен. Толпа ждёт зрелища",,,,,,,,,,,
7_4d_StrongFigter_cardLeft,,,"Не терять времени, воспользоваться ситуацией",,,,,,,,,,,
7_4d_StrongFigter_cardLeft_REV,,,"Вы бьёте ему в скулу - удар точный, и он пошатывается ещё сильнее",,,,,,,,,,,
7_4d_StrongFigter_cardRight,,,Попробовать обманный финт,,,,,,,,,,,
7_4d_StrongFigter_cardRight_REV,,,"Вы почти обманули его, но в последний момент он видит уловку и бьёт в ответ",,,,,,,,,,,
7_5_StrongFigter_bunner,,,"Вы оба тяжело дышите. Противник пошатывается, но его взгляд полон упрямства",,,,,,,,,,,
7_5_StrongFigter_cardLeft,,,Размахнуться на решающий удар,,,,,,,,,,,
7_5_StrongFigter_cardLeft_REV,,,Он уклоняется и бьёт в живот. Последний удар - и вы падаете в грязь,,,,,,,,,,,
7_5_StrongFigter_cardRight,,,"Сделать вид, что падаете, и ударить снизу",,,,,,,,,,,
7_5_StrongFigter_cardRight_REV,,,"Он тянется вас добить - и получает в живот, противник повержен. Толпа радостно визжит, и вы возвращаетесь в трактир",,,,,,,,,,,
7_AfterCombat_bunner,,,"На сцену выходит пьяный бард и анонсирует - следующая песня называется ""кривоногая Мария из низины"" и посвящается моей жене",,,,,,,,,,,
7_AfterCombat_cardLeft,,,Выпить еще,,,,,,,,,,,
7_AfterCombat_cardLeft_REV,,,Вы возвращаетесь за стол и продолжаете пить эль,,,,,,,,,,,
7_AfterCombat_cardRight,,,Однозначно выпить еще,,,,,,,,,,,
7_AfterCombat_cardRight_REV,,,Вы возвращаетесь за стол и продолжаете пить эль,,,,,,,,,,,
7_1_drunkStory_bunner,,,"Эль вас веселит, щёки разгорелись, пузо налилось уютной тяжестью, язык болтает сам по себе, мир чуть покачивается, но в этом даже есть прелесть",,,,,,,,,,,
7_1_drunkStory_cardLeft,,,Поднять тост за старые добрые времена,,,,,,,,,,,
7_1_drunkStory_cardLeft_REV,,,"Вы встаёте из-за стола, размахиваете кружкой и вспоминаете что-то трогательное… вам так кажется",,,,,,,,,,,
7_1_drunkStory_cardRight,,,Обнять ближайшего соседа и начать петь,,,,,,,,,,,
7_1_drunkStory_cardRight_REV,,,"Вы не уверены, кто рядом, но обнимаете крепко. Голос срывается, но душа поёт",,,,,,,,,,,
7_2A_drunkStory_bunner,,,"Ваш тост выходит сбивчивым, кружка почти пуста, но глаза блестят. Тело требует продолжения",,,,,,,,,,,
7_2A_drunkStory_cardLeft,,,Опереться на столб для равновесия,,,,,,,,,,,
7_2A_drunkStory_cardLeft_REV,,,"Вы облокачиваетесь на столб, потом обнимаете его. Через минуту ведёте с ним душевную беседу. Кажется, он понимает",,,,,,,,,,,
7_2A_drunkStory_cardRight,,,Попытаться дойти до двери,,,,,,,,,,,
7_2A_drunkStory_cardRight_REV,,,"Вы почти выходите, но врезаетесь плечом в косяк. Вас закружило, и вы вырубились прямо рядом с дверью",,,,,,,,,,,
7_2B_drunkStory_bunner,,,"Вы вместе с соседями поёте хором. Голова кружится, ноги подрагивают, настроение на пике. Вы пьяны — по-настоящему",,,,,,,,,,,
7_2B_drunkStory_cardLeft,,,"Решить, что можете станцевать",,,,,,,,,,,
7_2B_drunkStory_cardLeft_REV,,,"Вы встаете из-за стола, но ноги вас не слушаются и делая интересное движение вы приземляетесь рядом с дверью и засыпаете ",,,,,,,,,,,
7_2B_drunkStory_cardRight,,,Пойти размяться на улице,,,,,,,,,,,
7_2B_drunkStory_cardRight_REV,,,"Вы выходите на воздух, чтобы показать, кто тут чемпион - и падаете в лужу. Последнее, что видите - курицу, смотрящую на вас",,,,,,,,,,,
7_3B_drunkStory_bunner,,,"Вы приходите в себя от того, что солнце светит вам в глаза, двор трактира пуст. Голова гудит, одежда пахнет элем и дымом",,,,,,,,,,,
7_3B_drunkStory_cardLeft,,,"Подняться, отряхнуться и осмотреться",,,,,,,,,,,
7_3B_drunkStory_cardLeft_REV,,,"Трактирщик смеется над вами, а потом дает сытную похлебку. Теперь вы готовы пойти к Царю и узнать что там за беда",,,,,,,,,,,
7_3B_drunkStory_cardRight,,,Перебраться на сеновал и вздремнуть еще часок - другой,,,,,,,,,,,
7_3B_drunkStory_cardRight_REV,,,"Вы сладко засыпаете, и вдруг вас находит царская стража. Вас поднимают и ведут, пошатываясь, к царю",,,,,,,,,,,
7_3C_drunkStory_bunner,,,"Вы просыпаетесь с головной болью и ощущением, будто вас вчера переехала телега. Курица всё ещё рядом. Из трактира доносится шум - новый день начался",,,,,,,,,,,
7_3C_drunkStory_cardLeft,,,Попытаться встать с достоинством,,,,,,,,,,,
7_3C_drunkStory_cardLeft_REV,,,"Вы поднимаетесь, тяжело дыша. Никто, кроме курицы, не видел этого, так что получилось почти достойно",,,,,,,,,,,
7_3C_drunkStory_cardRight,,,Попытаться нащупать что-то что поможет вам встать,,,,,,,,,,,
7_3C_drunkStory_cardRight_REV,,,"Ваша рука натыкается на большой половник, вы используете его вместо посоха. И отправляетесь в замок к царю",,,,,,,,,,,
