Key,Desc,English,Russian,Spanish,Chinese (Simplified),Belarusian,French,German,Italian,Japanese,Korean,,Turkish,Ukrainian
4_SpyOnGuards_cardLeft_REV,,"You take the cape from the counter, disguise yourself as an old lady and get as close as possible","Вы берёте платок с прилавка, маскируетесь под старушку и подходите максимально близко","Sacas la tela del mostrador, te disfrazas de anciana y te acercas lo más posible",,,,,,,,,,
4_SpyOnGuards_cardRight,,,Дождаться пока стража отойдет от палатки,,,,,,,,,,,
4_SpyOnGuards_cardRight_REV,,After the guards leave you run up to the merchant and ask what they wanted,"После того как стража уходит вы подбегаете к торговцу и спрашиваете, чего они хотели","Después de que los guardias se vayan, corres hacia el comerciante y le preguntas qué querían",,,,,,,,,,
4_TiedUp_bunner,,"You have been beaten, tied up, and now you
are considering further actions","Вас поколотили, связали, и теперь вы 
обдумываете дальнейшие действия","Te golpearon, te ataron y ahora tienes tiempo para pensar",,"Вас пакалечылі, звязалі, і цяпер вы абдумваеце далейшыя дзеянні.",,,,,,,,
4_TiedUp_cardLeft,,Calm down,Успокоиться,Tranquilizarse,,Супакоіцца.,,,,,,,,
4_TiedUp_cardLeft_REV,,You decide that you've warmed up enough and can continue your journey,"Вы решаете, что достаточно размялись и можно продолжить путь",Decides que ya has calentado lo suficiente y puedes continuar tu camino,,"Астатак шляху вы паводзілі сябе спакойна, і вас даставілі прама ў замак да цара.",,,,,,,,
4_TiedUp_cardRight,,Try to untie your hands,Попытаться развязать руки,Intenta desatar tus manos,,Паспрабаваць развязаць рукі.,,,,,,,,
4_TiedUp_cardRight_REV,,You started to curl as you fell out of the cart on a bump and broke your head,Вы начали виться как уж и на кочке выпали из повозки и разбили голову,Comenzaste a retorcerte como una serpiente y caíste del carro y te rompiste la cabeza,,"Вы пачалі звіцца, як вуж, і на кочцы выпалі з повозкі, разбіўшы галаву.",,,,,,,,
4_WomanGive_bunner,,"You have met a woman, she holds out her hand to you","По пути вам встретилась женщина, она протягивает вам руку","Has conocido a una mujer, ella te tiende la mano",,"Вам сустрэлася жанчына, яна працягвае вам руку.",,,,,,,,
4_WomanGive_cardLeft,,To extend a hand in response,Протянуть руку в ответ,Echar una mano en respuesta,,Пратягнуць руку ў адказ.,,,,,,,,
4_WomanGive_cardLeft_REV,,A woman gives you an apple,Женщина дает вам яблоко,Mujer te da una manzana,,У жанчыны ў руцэ нешта ёсць.,,,,,,,,
4_WomanGive_cardRight,,Don't pay attention,Не обращать внимания,No prestes atención,,Отмахнуцца ад яе.,,,,,,,,
4_WomanGive_cardRight_REV,,You're pretending not to notice her,Вы делаете вид что не замечаете ее,Estás fingiendo no darte cuenta de ella,,"Вы робіце выгляд, што не заўважаеце яе.",,,,,,,,
5_Go4Princess_bunner,,Go alone or go to the King's castle first,Пойти в одиночку или сначала отправиться в замок к Царю,Ve solo o ve primero al castillo del rey,,,,,,,,,,
5_Go4Princess_cardLeft,,Going solo,Пойти в одиночку,Yendo solo,,,,,,,,,,
5_Go4Princess_cardLeft_REV,,Suddenly the demo police show up and won't let you go solo,Внезапно появляется полиция демоверсии и не позволяет вам идти в соло,"De repente, la policía de demostración aparece y no te deja ir solo",,,,,,,,,,
5_Go4Princess_cardRight,,Go to the king's castle,Отправиться в замок к царю,Ir al castillo del rey,,,,,,,,,,
5_Go4Princess_cardRight_REV,,"You go to the king's palace, imagining a defeated dragon, a princess, and mountains of treasure","Вы идете к царю во дворец, представляя поверженного дракона принцессу и горы сокровищ, ну-ну","Vas al palacio del rey, imaginando un dragón derrotado, una princesa y montañas de tesoros",,,,,,,,,,
5_1_TraderCallPolice_bunner,,The merchant recognizes you and calls loudly to the guards,Торговец узнает вас и громко зовет стражу,El comerciante te reconoce y llama en voz alta a los guardias,,,,,,,,,,
5_1_TraderCallPolice_cardLeft,,Wait for the guards,Дождаться стражников,Espera a los guardias reales,,,,,,,,,,
5_1_TraderCallPolice_cardLeft_REV,,"Running away is not in your habits, you meet danger head on","Убегать не в ваших привычках, вы встречаете опасности лицом","Huir no está en tus hábitos, te enfrentas al peligro de frente",,,,,,,,,,
5_1_TraderCallPolice_cardRight,,Walk away,Уйти,Irse,,,,,,,,,,
5_1_TraderCallPolice_cardRight_REV,,"You don't want to talk to the guards, so you go to the tavern","Вам не охота болтать со стражей, и вы отправляетесь в трактир","No quieres hablar con los guardias, así que ve a la taberna",,,,,,,,,,
,,,,,,,,,,,,,,
,,,,,,,,,,,,,,
,,,,,,,,,,,,,,
,,,,,,,,,,,,,,
,,,,,,,,,,,,,,
5_1_GuardsGone_bunner,,"You are distracted by the movement of the crowd and, you notice that the guards have already left and the merchant removes the picture and retires to his tent","Вы отвлекаетесь на движение толпы и, замечаете, что стража уже ушла, а торговец убирает бумагу и уходит в свой шатер",,,,,,,,,,,
5_1_GuardsGone_cardLeft,,Waste no time and continue to search for guards in the bazaar,Не терять времени и продолжить искать стражу на рынке,,,,,,,,,,,
5_1_GuardsGone_cardLeft_REV,,You lose sight of the guards and head to the tavern to get the latest news,"Вы теряете стражников из виду, и отправляетесь в трактир чтобы узнать последние новости",,,,,,,,,,,
5_1_GuardsGone_cardRight,,Take a stroll through the bazaar,Прогуляться по рынку ,,,,,,,,,,,
5_1_GuardsGone_cardRight_REV,,You decide to wander the bazaar looking for rumors,Вы решаете прогуляться по рынку в поисках слухов,,,,,,,,,,,
5_2_RunHarbor_bunner,,"Fleeing from your pursuers, you run to the harbor","Спасаясь от преследователей, вы бежите на пристань","Huyendo de tus perseguidores, corres hacia el puerto",,,,,,,,,,
5_2_RunHarbor_cardLeft,,Hide in a barrel of salted meat,Спрятаться в бочке с засоленным мясом,Escóndete en un barril de carne salada,,,,,,,,,,
5_2_RunHarbor_cardLeft_REV,,"The guards find you in a barrel and send you to prison, you manage to steal a piece of meat from the barrel","Стражники находят вас в бочке, и отправляют в темницу, вы успеваете стащить кусок мяса из бочки ","Los guardias te encuentran en un barril y te envían a prisión, logras robar un trozo de carne del barril",,,,,,,,,,
5_2_RunHarbor_cardRight,,Run up to the ship and pretend to be an old lady with a scarf on,"Забежать на корабль и прикинуться старушкой, накинув платок",Ir al barco y fingir ser una anciana con un pañuelo en la cabeza,,,,,,,,,,
5_2_RunHarbor_cardRight_REV,,"You put your headscarf on your head again in disguise, but the captain shouts: “A woman on the ship - be trouble!” and throws you ashore","Вы снова накидываете платок на голову маскируясь, но капитан кричит - Баба на корабле - быть беде! и выгоняет вас на берег","Te vuelves a poner el pañuelo en la cabeza disfrazado, pero el capitán grita: ""¡Una mujer en el barco, ¡sé un problema!""y te arroja a tierra",,,,,,,,,,
5_1_RunHarbor_bunner,,"Fleeing from your pursuers, you run to the harbor","Спасаясь от преследователей, вы бежите на пристань","Huyendo de tus perseguidores, corres hacia el puerto",,,,,,,,,,
5_1_RunHarbor_cardLeft,,Hide in a crawfish barrel,Спрятаться в бочке с раками,Esconderse en un barril de cangrejo de río,,,,,,,,,,
5_1_RunHarbor_cardLeft_REV,,The crayfish are using their claws. You jump out of the barrel screaming. The guards catch you and throw you in prison,"Ну откуда вам было знать, что раки могут напасть на вас? Вы с криком выпрыгиваете из бочки. Стража ловит вас и бросает в темницу",Los cangrejos usan sus garras. Usted con un grito salta de un barril. Los guardias te atrapan y te arrojan a la cárcel,,,,,,,,,,
5_1_RunHarbor_cardRight,,Run for the departing ship,Забежать на отплывающий корабль,Corre hacia el barco que sale,,,,,,,,,,
5_1_RunHarbor_cardRight_REV,,"You run to the ship, grabbing a dangling uniform, pretending to be a sailor","Вы бежите на корабль, попутно хватая висящую форму, прикидываетесь матросом","Corres hacia el barco, agarrando un uniforme colgando, fingiendo ser un marinero",,,,,,,,,,
5_2_GuardsTellStory_bunner,,"One of the guards tells us that a great misfortune has happened, and the king orders us to come to the castle","Стражники подходят и один из них рассказывает, что случилось несчастье и король приказывает нам явиться в замок","Uno de los guardias reales nos dice que ha sucedido una gran desgracia, y el rey nos ordena que vayamos al castillo",,,,,,,,,,
5_2_GuardsTellStory_cardLeft,,No mortal dares to command me,Никто из смертных не смеет мне приказывать,Ningún mortal se atreve a mandarme,,,,,,,,,,
5_2_GuardsTellStory_cardLeft_REV,,"You kick one of the guards with your foot, just like in your favorite fairy tale, and he flies over the fruit counter","Вы пинаете одного из стражников ногой, прямо как в вашей любимой сказке и он перелетает через прилавок с фруктами","Pateas a uno de los guardias con el pie, como en tu cuento de hadas favorito, y él vuela sobre el mostrador de frutas",,,,,,,,,,
5_2_GuardsTellStory_cardRight,,Agree to go,Согласиться пойти,Aceptar ir,,,,,,,,,,
5_2_GuardsTellStory_cardRight_REV,,Your adventurous spirit awakens and you follow the guards into the castle,"В вас просыпается дух авантюризма, и вы следуете в замок вместе со стражей",Tu espíritu aventurero despierta y sigues a los guardias hasta el castillo,,,,,,,,,,
,,,,,,,,,,,,,,
5_2_StealAppleCatch_bunner,,"Shamefully pulling your hand away from the counter, you accidentally push a woman with a basket and all the products fly away","С позором одергивая руку от прилавка, вы случайно толкаете женщину с корзинкой и все продукты разлетаются","Vergonzosamente, al apartar la mano del mostrador, accidentalmente empujas a una mujer con una canasta y todos los productos salen volando",,,,,,,,,,
5_2_StealAppleCatch_cardLeft,,You try to catch all the food in the air,Попытаться поймать все продукты в воздухе,Tratas de atrapar toda la comida en el aire,,,,,,,,,,
5_2_StealAppleCatch_cardLeft_REV,,You make sudden movements with your hands in the air and accidentally hit a passerby's ear with your finger,Вы делаете резкие движения руками в воздухе и случайно попадаете пальцем в ухо прохожему,Haces movimientos bruscos con las manos en el aire y golpeas accidentalmente la oreja de un transeúnte con el dedo,,,,,,,,,,
5_2_StealAppleCatch_cardRight,,,Воспользоваться суматохой и все - таки стащить хоть что - то с прилавка,,,,,,,,,,,
5_2_StealAppleCatch_cardRight_REV,,You manage to grab an ear of corn,Вам удается ухватить початок кукурузы,Te las arreglas para agarrar una mazorca de maíz,,,,,,,,,,
5_3_FingerEar_bunner,,,"Прохожий, оказался слепым монахом! Он хватает вас за руку и шепчет - Сын мой ты напал на служителя божьего, ждут тебя проклятия!",,,,,,,,,,,
5_3_FingerEar_cardLeft,,,Отшутиться,,,,,,,,,,,
5_3_FingerEar_cardLeft_REV,,,"Вы спрашиваете, когда у них скидки на снятие проклятия.

Шутка его рассмешила, и он уходит",,,,,,,,,,,
5_3_FingerEar_cardRight,,,Освободиться,,,,,,,,,,,
5_3_FingerEar_cardRight_REV,,,"Высвобождая руку, вы отходите на шаг от него, но монах оказался прытким - больно бьет вас палкой по голове и уходит",,,,,,,,,,,
5_3_BoyCatchU_bunner,,,Ваше воровство замечает тощий мальчишка,,,,,,,,,,,
5_3_BoyCatchU_cardLeft,,,Пожалеть мальца и отдать ему кукурузу,,,,,,,,,,,
5_3_BoyCatchU_cardLeft_REV,,,Вас царские ищут… Но я так уж и быть ничего им не скажу,,,,,,,,,,,
5_3_BoyCatchU_cardRight,,,Прогнать его,,,,,,,,,,,
5_3_BoyCatchU_cardRight_REV,,,"Мальчишка расстроился.

 Он это запомнит",,,,,,,,,,,
5_3_AngryWoman_bunner,,,"Вы совсем забыли про женщину, которую толкнули, а вот она про вас совсем нет",,,,,,,,,,,
5_3_AngryWoman_cardLeft,,,"Сделать вид, что не заметили",,,,,,,,,,,
5_3_AngryWoman_cardLeft_REV,,,Вы отворачиваетесь - и получаете корзиной по спине,,,,,,,,,,,
5_3_AngryWoman_cardRight,,,Извиниться и предложить помочь,,,,,,,,,,,
5_3_AngryWoman_cardRight_REV,,,"Пока вы складываете продукты, рука сама уносит одну сливу в карман",,,,,,,,,,,
5_4_BazaarEnd_bunner,,,"Во время своего маленького приключения вы упускаете стражу из виду, и дорога приводит вас к вратам царского дворца",,,,,,,,,,,
5_4_BazaarEnd_cardLeft,,Tell the guards at the gate that you're going to the King's summons,Сказать охране на воротах что вы идете по вызову Царя,Dile a los guardias en la puerta que vas a la citación del Rey,,,,,,,,,,
5_4_BazaarEnd_cardLeft_REV,,"The guards look at each other, sigh, and show you where to go next","Стражники переглядываются между собой, вздыхают и показывают куда вам нужно идти далее","Los guardias se miran, suspiran y te muestran a dónde ir a continuación",,,,,,,,,,
5_4_BazaarEnd_cardRight,,Turn around and go to the tavern,Развернуться и пойти в трактир,Darse la vuelta e ir a la taberna,,,,,,,,,,
5_4_BazaarEnd_cardRight_REV,,You decide that first you need to get the latest news from a credible source,"Вы решаете, что для начала вам нужно узнать последние новости из достоверного источника",Usted decide que primero necesita obtener las últimas noticias de una fuente creíble,,,,,,,,,,
5_TakeApple_bunner,,"The apple is juicy and red, and it looks like it's very fresh","Яблоко сочное, красное, похоже, что оно очень свежее ","La manzana es jugosa y roja, y parece muy fresca",,Яна дала вам смачнае чырвонае яблык.,,,,,,,,
5_TakeApple_cardLeft,,Eat an apple,Съесть яблоко,Comer una manzana,,З'есці яблык,,,,,,,,
5_TakeApple_cardLeft_REV,,You eat an apple and it fills you with energy,"Вы съедаете яблоко, и оно наполняет вас энергией",Te comes una manzana y te llena de energía,,Вы з'ядаеце яблык і яно напаўняе вас энергіяй,,,,,,,,
5_TakeApple_cardRight,,Put it in your pocket,Положить его в карман,Póngalo en su bolsillo,,Пакласці яго ў кішэню,,,,,,,,
5_TakeApple_cardRight_REV,,"The apple is very beautiful and shiny, but you are not hungry and hide it in your pocket","Яблоко очень красивое и блестящее, но вы не голодны и прячете его в карман","La manzana es muy hermosa y brillante, pero no tienes hambre y la escondes en tu bolsillo",,"Яблык вельмі прыгожае і бліскучае, але вы не галодныя і хаваеце яго ў кішэню",,,,,,,,
5_TakeNAIL_bunner,,Keep it for yourself or throw it on the ground,Оставить себе или выкинуть на землю,Guárdalo para ti o tíralo al suelo,,Заставіць сабе ці выкінуць на зямлю.,,,,,,,,
5_TakeNAIL_cardLeft,,Throw away,Выбросить,Tirar a la calle,,Выкідваць.,,,,,,,,
5_TakeNAIL_cardLeft_REV,,"You throw out the nail, nothing happens","Вы выкидываете гвоздь на дорогу, ничего не происходит",Has tirado un clavo en la carretera,,"Вы выкідваеце гваздь, нічога не адбываецца.",,,,,,,,
5_TakeNAIL_cardRight,,Keep it for yourself,Оставить себе,Guárdatelo para ti,,Вы захоўваеце гваздь у сябе.,,,,,,,,
5_TakeNAIL_cardRight_REV,,"Obviously you are very economical, you put a nail in your pocket","Очевидно, вы очень хозяйственный, кладете гвоздь себе в карман","Obviamente eres muy económico, te pones un clavo en el bolsillo",,"Аглядзіцеся, відаць, вы вельмі гаспадарлівы і кладзеце гваздь у свой кішэню.",,,,,,,,
6_WagonStop_bunner,,,"Телега резко дёргается и замирает. Колёса глубоко увязли в грязи, лошади беспокойно фыркают. Стражники вздыхают, готовясь толкать",,,,,,,,,,,
6_WagonStop_cardLeft,,,Помочь стражникам вытолкать телегу,,,,,,,,,,,
6_WagonStop_cardLeft_REV,,,"Телега поддаётся, но ты падаешь в грязь. Стражники смеются, а ты весь в грязи. Путешествие начинается ""удачно""",,,,,,,,,,,
6_WagonStop_cardRight,,,Остаться сидеть в телеге - это не ваше дело,,,,,,,,,,,
6_WagonStop_cardRight_REV,,,"Телега сдвигается, но вы слышите странный щелчок от колеса - но стражники, кажется, не заметили",,,,,,,,,,,
6_GuardsSeekinU_bunner,,You're watching the guards combing the neighborhood,Вы смотрите как стража прочесывает окрестности,Estás viendo a los guardias peinando el vecindario,,,,,,,,,,
6_GuardsSeekinU_cardLeft,,Yell out to the guards,Окрикнуть их,Empezar a burlarse de los guardias,,,,,,,,,,
6_GuardsSeekinU_cardLeft_REV,,"You taunt the guards, feeling your impunity, they don't appreciate it and promise to catch you","Вы дразните стражу, чувствуя свою безнаказанность, они не оценили этого и обещают вас поймать","Te burlas de los guardias, sintiendo tu impunidad, no lo aprecian y prometen atraparte",,,,,,,,,,
6_GuardsSeekinU_cardRight,,To leave the harbor in silence,Молча покинуть гавань,En silencio abandonar el puerto,,,,,,,,,,
6_GuardsSeekinU_cardRight_REV,,You see the guards leave without finding anyone,"Вы видите, как стражники уходят не найдя никого",Ves a los guardias irse sin encontrar a nadie,,,,,,,,,,
6_GuardsSeekinU2_bunner,,The guards are still looking for you at the wharf,Стража все еще ищет вас на пристани,The guards are still looking for you at the wharf,,,,,,,,,,
6_GuardsSeekinU2_cardLeft,,Hide in a barrel,Спрятаться в бочке,Esconderse en un barril,,,,,,,,,,
6_GuardsSeekinU2_cardLeft_REV,,"You hid in a barrel of rotten fish, the stench was disgusting and you had to climb out and surrender to the guards","Вы спрятались в бочке с тухлой рыбой, вонь была омерзительная и вам пришлось вылезти и сдаться страже","Te escondiste en un barril de pescado podrido, el hedor era asqueroso y tuviste que salir y rendirte a los guardias",,,,,,,,,,
6_GuardsSeekinU2_cardRight,,Run towards home through the forest,Бежать в сторону дома через лес,Corre hacia casa a través del bosque,,,,,,,,,,
6_GuardsSeekinU2_cardRight_REV,,"It was already starting to get dark, the guards tried to run after you into the forest, but fear and superstition stopped them","Уже начало темнеть, стражники попытались бежать за вами в лес, но страх и суеверия их остановили","Ya empezaba a oscurecer, los guardias intentaron correr tras ti hacia el bosque, pero el miedo y la superstición los detuvieron",,,,,,,,,,
6_to_Castle_how_bunner,,,"Продолжая следовать за стражей, вы подходите к воротам дворца, вы видите как они скрываются за воротами ",,,,,,,,,,,
6_to_Castle_how_cardLeft,,,Тайно проследовать за стражей в замок,,,,,,,,,,,
6_to_Castle_how_cardLeft_REV_YES,,,"Подойдя к воротам замка вы, накинув платок на голову сливаетесь с четырьмя монахами",,,,,,,,,,,
6_to_Castle_how_cardLeft_REV_NO,,,"Стражники замечают, что вы не монах и интересуются целью вашего визита",,,,,,,,,,,
6_to_Castle_how_cardRight,,,Попытаться пройти без маскировки,,,,,,,,,,,
6_to_Castle_how_cardRight_REV,,,"Стражники интересуются целью вашего визита

Вы отвечаете, что пришли по приказу царя",,,,,,,,,,,
6_Castle_Gate_bunner,,,Стражники нахмурившись смотрят на вас,,,,,,,,,,,
6_Castle_Gate_cardLeft,,,Рассказать им всю историю от начала до этого момента,,,,,,,,,,,
6_Castle_Gate_cardLeft_REV,,,"Стражники переглядываются между собой, вздыхают и показывают куда вам нужно идти далее",,,,,,,,,,,
6_Castle_Gate_cardRight,,,"Сказать, что знаете, что случилось и готовы помочь если будет достойное вознаграждение",,,,,,,,,,,
6_Castle_Gate_cardRight_REV,,,"Стражники переглядываются между собой, и c улыбкой показывают куда вам нужно идти далее",,,,,,,,,,,
6_in_Castle_bunner,,You get behind the palace walls and immediately turn down a dark corridor to avoid being seen by the guards,"Вы попадаете за дворцовые стены и сразу сворачиваете в темный коридор, чтобы не попасться страже на глаза",Te pones detrás de los muros del palacio e inmediatamente bajas por un pasillo oscuro para evitar ser visto por los guardias,,,,,,,,,,
6_in_Castle_winner,,And what the hero saw you will learn from the full version,А что увидел герой вы узнаете из полной версии,Y lo que vio el héroe lo aprenderás de la versión completa,,,,,,,,,,
6_in_Castle_cardLeft,,Light the torch hanging on the wall,"Зажечь факел, висящий на стене",Enciende la antorcha colgada en la pared,,,,,,,,,,
6_in_Castle_cardLeft_REV,,"The light was seen by passing guards, you were seized and sent to the prison, paying no attention to your stories","Свет увидели мимо проходящие стражники, вас схватили и отправили в темницу, не обращая внимания на ваши рассказы","La luz fue vista por los guardias que pasaban, te apresaron y te enviaron a la prisión, sin prestar atención a tus historias",,,,,,,,,,
